{
  "aop": {
    "abstract": "Example abstract",
    "adverse_outcomes": [
      {
        "id": "KE:3",
        "iri": "https://identifiers.org/aop.events/3",
        "title": "Adverse outcome"
      }
    ],
    "evidence_summary": "Overall Moderate support.",
    "graph": null,
    "id": "AOP:232",
    "iri": "https://identifiers.org/aop/232",
    "ker_count": 3,
    "key_event_count": 3,
    "molecular_initiating_events": [
      {
        "id": "KE:1",
        "iri": "https://identifiers.org/aop.events/1",
        "title": "MIE"
      }
    ],
    "overall_applicability": {
      "basis": "Not yet exposed as a dedicated AOP-level field in the current RDF export. Placeholder retained for the OECD-aligned contract.",
      "cell_types": [],
      "levels_of_biological_organization": [],
      "life_stages": [],
      "organs": [],
      "provenance": [
        {
          "confidence": "low",
          "field": "overall_applicability",
          "source": "aop_wiki_rdf",
          "transformation": "placeholder_pending_aop_level_normalization"
        }
      ],
      "sexes": [],
      "summary_rationale": null,
      "taxa": []
    },
    "provenance": [
      {
        "confidence": "moderate",
        "field": "get_aop",
        "source": "aop_wiki_rdf",
        "transformation": "phase1_oecd_alignment_normalization"
      },
      {
        "confidence": "low",
        "field": "stressor_chemicals",
        "source": "aop_db_sparql",
        "transformation": "phase2_stressor_enrichment"
      }
    ],
    "references": [
      {
        "identifier": "PMID:123456",
        "label": "Assessment reference",
        "source": "pmid"
      }
    ],
    "stressors": [],
    "title": "Example AOP"
  },
  "applicability_summary": {
    "basis": "Aggregated from key event metadata because AOP-level applicability is not consistently exposed in the current RDF export.",
    "cell_type_context": [
      "CL:0000182"
    ],
    "level_of_biological_organization": [
      "molecular",
      "cellular",
      "organ"
    ],
    "life_stage_applicability": [
      "adult"
    ],
    "organ_context": [
      "UBERON:0002107"
    ],
    "sex_applicability": [
      "female"
    ],
    "taxonomic_applicability": [
      "NCBITaxon:9606"
    ]
  },
  "biological_plausibility": {
    "basis": "Aggregated from KER biological plausibility text.",
    "coverage": {
      "present": 3,
      "total": 3
    },
    "heuristic_call": "strong",
    "oecd_dimension": true
  },
  "confidence_dimensions": {
    "biological_plausibility": {
      "basis": "Aggregated from KER biological plausibility text.",
      "coverage": {
        "present": 3,
        "total": 3
      },
      "heuristic_call": "strong",
      "oecd_dimension": true
    },
    "empirical_support": {
      "basis": "Aggregated from KER empirical support text.",
      "coverage": {
        "present": 3,
        "total": 3
      },
      "heuristic_call": "moderate",
      "oecd_dimension": true
    },
    "essentiality_of_key_events": {
      "basis": "Key-event essentiality is not directly surfaced in the current RDF export, and no bounded combination of text evidence plus path support was available to score it.",
      "coverage": {
        "present": 0,
        "total": 3
      },
      "heuristic_call": "not_assessed",
      "heuristic_inputs": {
        "ao_count": 1,
        "cue_count": 0,
        "mie_count": 1,
        "path_count": 2,
        "shared_internal_key_events": [],
        "text_signal": "not_reported"
      },
      "oecd_dimension": true,
      "provenance": [
        {
          "confidence": "low",
          "field": "essentiality_of_key_events",
          "source": "derived_from_aop_structure",
          "transformation": "phase3_essentiality_text_and_path_heuristic"
        }
      ]
    },
    "quantitative_understanding": {
      "basis": "Aggregated from KER quantitative understanding text.",
      "coverage": {
        "present": 2,
        "total": 3
      },
      "heuristic_call": "low",
      "oecd_dimension": true
    }
  },
  "coverage": {
    "assay_cutoff_ordering_supporting_chemicals": 0,
    "ker_count": 3,
    "kers_with_assay_cutoff_ordering": 0,
    "kers_with_biological_plausibility": 3,
    "kers_with_empirical_support": 3,
    "kers_with_quantitative_understanding": 2,
    "key_event_count": 3,
    "key_events_with_life_stage_applicability": 2,
    "key_events_with_measurement_methods": 2,
    "key_events_with_sex_applicability": 1,
    "key_events_with_taxonomic_applicability": 2
  },
  "empirical_support": {
    "basis": "Aggregated from KER empirical support text.",
    "coverage": {
      "present": 3,
      "total": 3
    },
    "heuristic_call": "moderate",
    "oecd_dimension": true
  },
  "essentiality_of_key_events": {
    "basis": "Key-event essentiality is not directly surfaced in the current RDF export, and no bounded combination of text evidence plus path support was available to score it.",
    "coverage": {
      "present": 0,
      "total": 3
    },
    "heuristic_call": "not_assessed",
    "heuristic_inputs": {
      "ao_count": 1,
      "cue_count": 0,
      "mie_count": 1,
      "path_count": 2,
      "shared_internal_key_events": [],
      "text_signal": "not_reported"
    },
    "oecd_dimension": true,
    "provenance": [
      {
        "confidence": "low",
        "field": "essentiality_of_key_events",
        "source": "derived_from_aop_structure",
        "transformation": "phase3_essentiality_text_and_path_heuristic"
      }
    ]
  },
  "heuristic_overall_call": "moderate",
  "ker_assessments": [
    {
      "assay_cutoff_ordering": {
        "basis": "CompTox access was unavailable, so supplemental assay-cutoff ordering could not be derived.",
        "concordant_chemical_count": 0,
        "discordant_chemical_count": 0,
        "downstream_candidate_assay_count": 0,
        "heuristic_call": "not_reported",
        "provenance": [
          {
            "confidence": "low",
            "field": "assay_cutoff_ordering",
            "source": "derived_from_ke_assays_and_comptox_bioactivity",
            "transformation": "phase4_assay_cutoff_ordering_missing_comptox"
          }
        ],
        "supporting_chemical_count": 0,
        "supporting_chemicals": [],
        "upstream_candidate_assay_count": 0
      },
      "assay_cutoff_ordering_call": "not_reported",
      "assay_cutoff_supporting_chemical_count": 0,
      "biological_plausibility": "Strong mechanistic rationale.",
      "biological_plausibility_call": "strong",
      "citation_concordance": {
        "basis": "Only one linked key event exposed supporting references, so shared-citation concordance could not be demonstrated. This is a weak supplemental heuristic and not evidence against the KER.",
        "downstream_reference_count": 0,
        "heuristic_call": "low",
        "provenance": [
          {
            "confidence": "low",
            "field": "citation_concordance",
            "source": "derived_from_ke_metadata",
            "transformation": "phase3_reference_overlap_partial"
          }
        ],
        "shared_reference_count": 0,
        "shared_references": [],
        "upstream_reference_count": 1
      },
      "citation_concordance_call": "low",
      "downstream": {
        "id": "KE:2",
        "iri": "https://identifiers.org/aop.events/2",
        "title": "Intermediate event"
      },
      "empirical_support": "Moderate support from dose-response studies.",
      "empirical_support_call": "moderate",
      "id": "KER:10",
      "quantitative_understanding": "Moderate quantitative support.",
      "quantitative_understanding_call": "moderate",
      "shared_reference_count": 0,
      "title": "MIE leads to intermediate event",
      "upstream": {
        "id": "KE:1",
        "iri": "https://identifiers.org/aop.events/1",
        "title": "MIE"
      }
    },
    {
      "assay_cutoff_ordering": {
        "basis": "CompTox access was unavailable, so supplemental assay-cutoff ordering could not be derived.",
        "concordant_chemical_count": 0,
        "discordant_chemical_count": 0,
        "downstream_candidate_assay_count": 0,
        "heuristic_call": "not_reported",
        "provenance": [
          {
            "confidence": "low",
            "field": "assay_cutoff_ordering",
            "source": "derived_from_ke_assays_and_comptox_bioactivity",
            "transformation": "phase4_assay_cutoff_ordering_missing_comptox"
          }
        ],
        "supporting_chemical_count": 0,
        "supporting_chemicals": [],
        "upstream_candidate_assay_count": 0
      },
      "assay_cutoff_ordering_call": "not_reported",
      "assay_cutoff_supporting_chemical_count": 0,
      "biological_plausibility": "Strong support.",
      "biological_plausibility_call": "strong",
      "citation_concordance": {
        "basis": "Neither linked key event exposed supporting references, so citation concordance could not be evaluated.",
        "downstream_reference_count": 0,
        "heuristic_call": "not_reported",
        "provenance": [
          {
            "confidence": "low",
            "field": "citation_concordance",
            "source": "derived_from_ke_metadata",
            "transformation": "phase3_reference_overlap_absent"
          }
        ],
        "shared_reference_count": 0,
        "shared_references": [],
        "upstream_reference_count": 0
      },
      "citation_concordance_call": "not_reported",
      "downstream": {
        "id": "KE:3",
        "iri": "https://identifiers.org/aop.events/3",
        "title": "Adverse outcome"
      },
      "empirical_support": "Strong support.",
      "empirical_support_call": "strong",
      "id": "KER:11",
      "quantitative_understanding": null,
      "quantitative_understanding_call": "not_reported",
      "shared_reference_count": 0,
      "title": "Intermediate event leads to adverse outcome",
      "upstream": {